{
  "$schema": "https://baize.dev/schema/v1/component-registry.schema.json",
  "id": "standard:victory-points",
  "name": "Victory Point Tokens",
  "component_type": "counter",
  "shape": "shield",
  "denominations": {
    "1": 1,
    "3": 3,
    "5": 5
  },
  "supply": "configurable",
  "physical": {
    "size_mm": [20, 20],
    "thickness_mm": 2.0,
    "material": "chipboard"
  },
  "note": "Generic victory point tokens for Eurogames. Available in denominations of 1, 3, and 5."
}
