{
  "$schema": "https://baize.dev/schema/v1/component-registry.schema.json",
  "id": "standard:d12",
  "name": "Standard 12-Sided Die",
  "component_type": "die",
  "faces": 12,
  "values": [1, 2, 3, 4, 5, 6, 7, 8, 9, 10, 11, 12],
  "display": "numeral",
  "physical_form": "d12_standard",
  "physical": {
    "size_mm": [18, 18],
    "thickness_mm": 18.0,
    "material": "plastic",
    "shape": "dodecahedron"
  }
}
